"","ID","URL","Title","body","Country","Group","Protest","Protest_Typ","Discrim","Discrim_Type"
"99",291,"https://bnr.bg/en/post/101293707/greece-and-romania-drop-quarantine-requirements-for-bulgarians","Greece and Romania drop quarantine requirements for Bulgarians"," Greece has dropped the mandatory quarantine requirements for Bulgarian citizens, Bulgaria’s Chief Directorate Border Police announced. EU nationals are allowed to cross Kulata, Ilinden, Makaza, Kapitan Petko Voivoda and Ivaylovgrad border checkpoints freely. However, random testing for Covid-19 is made. The border crossing Zlatograd-Thermes remains closed. The entry ban on non-EU citizens remains. Traffic via the Bulgaria-Greece checkpoints is intense. Romania has also dropped mandatory quarantine for Bulgarian citizens entering this country. Traffic at the main border checkpoints with Romania, Turkey and Serbia is normal. Foreign nationals travelling by personal vehicles and busses are banned from entering the Republic of North Macedonia. Those who exit North Macedonia can use Gyueshevo-Deve Bair border crossing only.   ""I believe in the power of real justice, I believe in the standard procedures of parliament and I hope that by following them we will achieve real justice. We shall not allow the prosecution to be used as a bludgeon."" This was what.. On Thursday morning there will be low visibility in the valleys and lowlands. It will be sunny during the day. Clouds will form over the mountains and Western Bulgaria in the afternoon hours with a chance of local showers. The lowest temperatures.. Relatives of people who died in road accidents staged a protest in front of the Sofia Court House and later in front of the National Assembly. The protest began with a minute's silence in memory of the perished. Protesters called for legislative..     The chairman of the State Agency for National Security (SANS) Plamen Tonchev announced at his hearing in the parliament today about an established case.. The caretaker cabinet is proposing, to the National Assembly, an extension of the budget 2022 extension law, until a new state budget for the current.. The Supreme Administrative Court of Bulgaria has definitively refused Russian opposition activist and opponent of Russia’s war against Ukraine.. english@bnr.bg +359 2 9336 661 ","BUL","bulgarian",0,0,0,0
"100",292,"https://bnr.bg/en/post/101301297/as-of-today-bulgarians-travelling-to-cyprus-required-to-have-negative-covid-19-test","As of today Bulgarians travelling to Cyprus required to have negative Covid-19 test","NULL","BUL","bulgarian",0,0,0,0
"101",294,"https://sofiaglobe.com/2020/06/29/ecfr-majority-of-bulgarians-view-of-us-unchanged-more-positive-towards-russia/","ECFR: Majority of Bulgarians’ view of US unchanged, more positive towards Russia","Bulgaria’s independent English-language news and features website.  Amid the coronavirus crisis, in most European countries, trust in the United States is broken – with the exception of Bulgaria, where 56 per cent say that their view of the US has not changed. This is among findings in a new polling-backed report, published on June 29 by the European Council on Foreign Relations (ECFR). The poll has found that, while many Europeans believe the European Union (EU) failed to provide sufficient leadership and support during the coronavirus crisis, a majority of citizens see European-level cooperation as the single-best vehicle for tackling major foreign policy issues, such as Covid-19 – particularly against a backdrop of US isolationism. It argues that this new pro-Europe sentiment, revealed from ECFR’s polling data, will be conditional and require delicate handling by Europe’s leaders, and Germany, as it assumes the presidency of the EU. The report, which is based on Datapraxis and YouGov polling from nine EU member states, provides a comprehensive analysis of the politics of the novel coronavirus, and also reveals a hollowing out of support for the transatlantic partnership – with just 2 per cent of polled Europeans expressing the view that the United States is a “helpful” ally in the fight with Covid-19. Authored by policy experts, Susi Dennison and Pawel Zerka, ‘Together in trauma: Europeans and the world after covid-19’ argues that Europe is in a state of “trauma” and that its citizens feel “alone and vulnerable” in their battle with the virus. It notes widespread dissatisfaction with national governments, and the failings of the EU, in response. It attributes Europe’s new, “trauma-like” condition to three causes: the first, from individual member-led responses and inadequate performance of national governments; the second, from the EU’s persistent failure to take ownership of international issues; and third, concerns about the new-world order in light of the EU’s fractured relationship with the US, and the threat China will pose to the international rules-based system. Key findings in ECFR’s new polling-backed report, include: ● Trust in the US is broken. In virtually every country, people were most likely to report that their perception of the US had become increasingly negative. In Denmark (71 per cent), Portugal (70 per cent), France (68 per cent), Germany (65 per cent) and Spain (64 per cent), around two-thirds said that their view of the US has worsened during the crisis. This was particularly marked in France and Germany, where 46 per cent and 42 per cent respectively said their view of the US had worsened ‘a lot’ as a result of the corona crisis. Only in Poland and Bulgaria was the dominant answer ‘no change’ (at 49 per cent and 56 per cent, respectively). The proportion of respondents who felt that the US had been a key ally through the crisis was vanishingly small, with the largest proportion in Italy, at just 6 per cent. ● The crisis has increased Europeans’ negativity towards China. Over 60 per cent in France (62 per cent) and Denmark (62 per cent) report a deteriorating perception of China. In every country higher proportions reported increasing negativity, rather than positivity, towards China, apart from in Bulgaria where an equal number (22 per cent) report an improved and worsened perception of China. Interestingly, in Italy, China was seen as the country’s most useful ally in the crisis by a quarter of those polled (25 per cent) – and particularly among supporters of Five Star (M5S) – probably because of its offer of ventilators and vital PPE, in the early stages of the pandemic. ● In every country a dominating share of voters reported no change in their perception of Russia, probably because the country has not played a high-profile role in the crisis. Among those whose perception has shifted, it is usually in a negative direction, especially in Denmark, Sweden, Germany and Poland. Two notable exceptions are Bulgaria (27 per cent) and Italy (23 per cent), where around a quarter of the population reported an improved perception of Russia, outnumbering those who say they view the Eastern country more negatively. Though, generally, improved perception of Russia is limited to voters of right-wing populists, it is a view more widely held in Italy by members of the M5S, as well as supporters of Lega and Brothers of Italy. ● There is strengthening support for action on climate change, despite the current health pandemic. Over 40 per cent in all member states polled, except in Denmark (22 per cent), Sweden (31 per cent) and France (37 per cent), said their support for the implementation of climate commitments has increased during the covid crisis. Spanish (60 per cent) and Portuguese (58 per cent) voters are most likely to say their support for the implementation of such commitments has increased. ● Many Europeans report a rising support for stricter border controls since the crisis began. From 48 per cent of the population in Denmark to 73 per cent in Portugal. More specifically, there were strong majorities in Bulgaria (61 per cent) and Portugal (60 per cent), and considerable minority views in Germany (46 per cent), Denmark (48 per cent) and France (46 per cent), for stricter controls at the EU’s external borders. ● Many of those advocating the closing of borders and returning power to nation states also recognise the value of developing more global responses from the EU. 42 per cent (in Sweden and Italy) to 76 per cent (in Bulgaria) of those calling for a more global response from the EU are at the same time supporting stronger controls of external borders. ● Most Europeans polled do not think the EU has “lived up to its responsibilities” in the pandemic. 63 per cent of Italians, 61 per cent of French and 52 per cent of Spaniards disagreed with the statement that the EU had done so. ‘Irrelevance’ was the way that a large plurality (and in some cases a majority) in every member state described the EU’s response. In France (58 per cent), Spain (45 per cent), Germany (44 per cent) and Bulgaria (50 per cent), those agreeing that the EU has been irrelevant during the coronavirus crisis, and that national or global responses are more important, outnumbered by a factor of three those who disagreed (18 per cent, 17 per cent, 15 per cent, and 18 per cent respectively). ● However, there is strong support for more cooperation in the EU. When asked whether the European response to the coronavirus crisis showed that there was a need for more European level cooperation or whether it showed that EU integration had gone too far, majorities in all countries opted for more cooperation. (91 per cent in Portugal, 80 per cent in Spain, 77 per cent in Italy, and 68 per cent in Poland). Even in less Europhile member states including France (52 per cent), Sweden (51 per cent) and Denmark (53 per cent), more than half of the respondents chose the cooperation option; and just around 20 per cent said the opposite. ● Europeans are split on whether EU institutions would help with the economic recovery. When asked where help would come from on the recovery, the largest proportion in Portugal (59 per cent), Poland (46 per cent), Spain (41 per cent), Bulgaria (37 per cent), and France (28 per cent) chose the EU. However, this is far less true in northern countries (Germany, Sweden, Denmark) for whom the crisis found a widespread perception that they had to handle such crises alone. For example, just under half of those polled in Germany (48 per cent) expressed the view that their ‘country can only rely on itself’ in its financial recovery from the crisis. Through segmentation of the polling, the paper’s authors, Dennison and Zerka, identify four constituencies that have emerged in Europe following the outbreak of the coronavirus, and examine areas of commonality across these groups and how they might be brought together on key issues of foreign policy. The first group – the ‘Engaged internationalists’ – are prominent in each of the polled member states. They are natural allies of the EU’s international ambitions, and, in many cases, are supporters of Europe’s centrist parties, including Partito Democratico (PD), in Italy, La Republique en Marche (LREM), in France, and the Civic Coalition (KO), in Poland. For example, in Italy (where ‘Engaged internationalists’ represent almost a third of the population), support for PD is twice as high within this group as in the country’s overall population. The second group – the ‘EU-critical internationalists’ – share in the vision of stronger Europe and, like the ‘Engaged internationalists’, are happy to support a greater financial solidarity among the EU member states, the implementation of climate commitments, and efforts to consolidate the production of medical and non-medical within the European bloc. However, they disagree with the basic conclusion that these should necessarily entail more EU integration or enlargement. In no country are they a dominating group of voters – but, everywhere, they correspond to at least a fifth of the electorate. Voters of FDP in Germany are likely to fall within this group, as well as those of Unidas Podemos in Spain, and the Brothers of Italy, in Italy. They also comprise many voters of the parties that are traditionally associated with the mainstream. The third group of voters – the “Switched-off Europeans” – is large, but less vocal on issues and the role of Europe in the post-covid world. This constituency is largely opposed to the idea of sharing the financial burden of the coronavirus among the EU’s member states, and are also more likely to want stricter border controls. However, they share some commonality with the previous groups, in their support for surveillance for health reasons and executing their climate commitments. They represent the largest group of voters in Bulgaria (31 per cent), and also have a strong presence in Portugal (23 per cent) and Italy (22 per cent). They are also, in many cases, the most politically diverse group: in France, for example, this group represents a quarter of the population and includes voters of La Republique en Marche, Rassemblement National, Les Republicains, and the Greens; while, in Poland, there is a similar story, with voters of PiS and Civic Coalition. And, last, the final group – the ‘Nation first’– is one dominated by supporters of populist or nationalist parties, including Lega, in Italy, PiS, in Poland, Vox, in Spain, SD, in Sweden, and Rassemeblement National, in France. People of this group are less likely to support global engagement, but share many of anxieties of the other groups. For example, in Germany, France and Denmark, a third of them are interested in bringing some production back – even if they may see it as a matter of national rather than European sovereignty – and everywhere, except for Denmark, Sweden and Germany, a third or more would support proposals for greater financial solidarity in Europe. Dennison and Zerka note that, while there are major divergences in opinion across the four groups, there are opportunities to bring them together on key issues. For example, even on politically challenging topics, such as border control, there is scope to build a broad coalition for the development of a procedural mechanism, which would allow the EU to respond, effectively, to major health and humanitarian crisis. Such a move would greatly reduce the probability of the national-led responses, which divide the bloc, and which ran through Europe in response to both covid-19 and the 2015 migrant crisis. Concluding, the authors reaffirm the point that “many Europeans feel that they have been left alone in this crisis”, and that to elicit their support for a strong European voice on the global stage, “policymakers will need to build coalitions by identifying where there is consensus”. To achieve a positive end, and prevent a new wave of Euroscepticism, it calls on EU leaders to set aside their ambitions of “more Europe”, and focus, instead, on identifying and constructing common denominators for the betterment of its members. ( Photo: Abdulhamid AlFadhly/freeimages.com) For the rest of The Sofia Globe’s continuing coverage of the Covid-19 situation in Bulgaria, please click here. Section supported by the Embassy of Switzerland Become a Patreon supporter of The Sofia Globe: Become a Patron! comments The Sofia Globe - the Sofia-based fully independent English-language news and features website, covering Bulgaria, the Balkans and the EU. Sign up to subscribe to sofiaglobe.com's daily bulletin through the form on our homepage. https://www.patreon.com/user?u=32709292 The Sofia Globe team can testify that upholding the globe is reminiscent of the work of Atlas. Please support us in continuing to offer - as we set out to do when we launched in June 2012 - journalism that is truly independent and informed. All donations are gratefully received as we put in place our plans to grow in the years ahead. Check your inbox or spam folder to confirm your subscription.  The Sofia Globe provides news, features, insight and analysis about Bulgaria, Central and Eastern Europe and the wider world according to the high professional standards of independence and objectivity that we have set ourselves in our Editorial Charter. Read more about us. Contacts For editorial, advertising and general inquiries, please e-mail [email protected]. Legal Notice Действителен собственик на настоящото издание е Клайв Левиев-Сойър.","BUL","bulgarian",0,0,0,0
"102",295,"https://bnr.bg/en/post/101291130/eurobarometer-80-of-all-bulgarians-see-corruption-as-mass-phenomenon","Eurobarometer: 80% of all Bulgarians see corruption as mass phenomenon","   ""I believe in the power of real justice, I believe in the standard procedures of parliament and I hope that by following them we will achieve real justice. We shall not allow the prosecution to be used as a bludgeon."" This was what.. On Thursday morning there will be low visibility in the valleys and lowlands. It will be sunny during the day. Clouds will form over the mountains and Western Bulgaria in the afternoon hours with a chance of local showers. The lowest temperatures.. Relatives of people who died in road accidents staged a protest in front of the Sofia Court House and later in front of the National Assembly. The protest began with a minute's silence in memory of the perished. Protesters called for legislative..     The chairman of the State Agency for National Security (SANS) Plamen Tonchev announced at his hearing in the parliament today about an established case.. The caretaker cabinet is proposing, to the National Assembly, an extension of the budget 2022 extension law, until a new state budget for the current.. The Supreme Administrative Court of Bulgaria has definitively refused Russian opposition activist and opponent of Russia’s war against Ukraine.. english@bnr.bg +359 2 9336 661 ","BUL","bulgarian",0,0,0,0
"103",296,"https://bnr.bg/en/post/101297283/no-bulgarians-injured-in-the-terrorist-incident-in-reading-uk","No Bulgarians injured in the terrorist incident in Reading, UK","   ""I believe in the power of real justice, I believe in the standard procedures of parliament and I hope that by following them we will achieve real justice. We shall not allow the prosecution to be used as a bludgeon."" This was what.. On Thursday morning there will be low visibility in the valleys and lowlands. It will be sunny during the day. Clouds will form over the mountains and Western Bulgaria in the afternoon hours with a chance of local showers. The lowest temperatures.. Relatives of people who died in road accidents staged a protest in front of the Sofia Court House and later in front of the National Assembly. The protest began with a minute's silence in memory of the perished. Protesters called for legislative..     The chairman of the State Agency for National Security (SANS) Plamen Tonchev announced at his hearing in the parliament today about an established case.. The caretaker cabinet is proposing, to the National Assembly, an extension of the budget 2022 extension law, until a new state budget for the current.. The Supreme Administrative Court of Bulgaria has definitively refused Russian opposition activist and opponent of Russia’s war against Ukraine.. english@bnr.bg +359 2 9336 661 ","none","bulgarian",0,0,0,0
"104",299,"https://bnr.bg/en/post/101295700/bulgarians-trust-in-eu-amidst-covid-19-crisis-survey","Bulgarians trust in EU amidst Covid-19 crisis: survey"," Trust in the European Union among Bulgarians remains stable, a sociological survey of Gallup commissioned by Konrad-Adenauer Foundation shows. The image of the EU did not suffer from the Covid-19 crisis. Awareness of the Recovery Plan for Europe is low, which is detrimental to confidence in Brussels. Nearly two-thirds of all Bulgarians think that the EU is needed, especially in this crisis. The majority of the respondents are firm supporters of democracy, but two-fifths of the surveyed nationals do not consider democracy appropriate in crisis management like the current one. 51% of the respondents want the EU to undertake common actions to exit the crisis. 46% think that a nation state should be at the forefront. 81% of the respondents say that limiting the spread of the epidemic is everyone’s responsibility.   ""I believe in the power of real justice, I believe in the standard procedures of parliament and I hope that by following them we will achieve real justice. We shall not allow the prosecution to be used as a bludgeon."" This was what.. On Thursday morning there will be low visibility in the valleys and lowlands. It will be sunny during the day. Clouds will form over the mountains and Western Bulgaria in the afternoon hours with a chance of local showers. The lowest temperatures.. Relatives of people who died in road accidents staged a protest in front of the Sofia Court House and later in front of the National Assembly. The protest began with a minute's silence in memory of the perished. Protesters called for legislative..     The chairman of the State Agency for National Security (SANS) Plamen Tonchev announced at his hearing in the parliament today about an established case.. The caretaker cabinet is proposing, to the National Assembly, an extension of the budget 2022 extension law, until a new state budget for the current.. The Supreme Administrative Court of Bulgaria has definitively refused Russian opposition activist and opponent of Russia’s war against Ukraine.. english@bnr.bg +359 2 9336 661 ","none","bulgarian",0,0,0,0
"105",300,"https://bnr.bg/en/post/101296629/53-of-bulgarians-say-the-worst-of-the-pandemic-is-over-survey","53% of Bulgarians say the worst of the pandemic is over: Survey"," As of mid-June 53% of Bulgarians say they believe that the worst of the coronavirus pandemic is behind us, and 13% believe that the worst is yet to come, indicate data from a social survey by Exacta Research Group, conducted in the 6-13 June period among 1,000 Bulgarians aged over 18. 69% describe as adequate the restrictive measures in place from March until May, 2020, to curb the spread of coronavirus in Bulgaria. 64% describe as adequate the measures to relax the state of emergency as of the beginning of May. 89% of the respondents say they observe the anti-epidemic measures. 9% say they know someone who has been infected with coronavirus.   ""I believe in the power of real justice, I believe in the standard procedures of parliament and I hope that by following them we will achieve real justice. We shall not allow the prosecution to be used as a bludgeon."" This was what.. On Thursday morning there will be low visibility in the valleys and lowlands. It will be sunny during the day. Clouds will form over the mountains and Western Bulgaria in the afternoon hours with a chance of local showers. The lowest temperatures.. Relatives of people who died in road accidents staged a protest in front of the Sofia Court House and later in front of the National Assembly. The protest began with a minute's silence in memory of the perished. Protesters called for legislative..     The chairman of the State Agency for National Security (SANS) Plamen Tonchev announced at his hearing in the parliament today about an established case.. The caretaker cabinet is proposing, to the National Assembly, an extension of the budget 2022 extension law, until a new state budget for the current.. The Supreme Administrative Court of Bulgaria has definitively refused Russian opposition activist and opponent of Russia’s war against Ukraine.. english@bnr.bg +359 2 9336 661 ","BUL","bulgarian",0,0,0,0
"106",305,"https://financialit.net/news/covid-19/italians-and-bulgarians-most-actively-invest-p2p-lending-during-pandemic","Italians and Bulgarians most actively invest in P2P lending during the pandemic","According to the statistics of the European P2P lending platform Robo.cash, the highest number of new investors who joined the platform from February to May came from Italy. At the same time, the highest increase in the volume of investments added to the platform in this period was by Bulgarian investors.For the period February 1 - May 31, 2020, the number of investors from Italy on Robo.cash increased by 28%, whereas the number of new users from France grew by 24%. The share of investors from the Czech Republic, Belgium rose by 13%, Switzerland and Spain - 12%.Meanwhile, the highest increase in the volume of funds added to the P2P lending platform during this period belongs to investors from Bulgaria. As of May 31st, it grew by 22% compared to the state on January 31, 2020. Italian and Swiss investors came next by the dynamics of their deposits on the platform. The volume of their funds increased by 18% and 17%, respectively.   As for Bulgarian investors, whose investments have grown most on the platform, they have shown an increasing interest in investments in P2P lending over the past year. Also, the impact of the pandemic on Bulgaria has not been so strong as on other European countries - to date, the country has reported 3,800 coronavirus cases. Get FinTech news headlines, videos, stories and product reviews on your mobile device. Download Financial IT App for Free","BUL","bulgarian",0,0,0,0
"107",307,"https://www.eu-journalists.eu/2020/06/19/nrws-laschet-walks-back-romanians-and-bulgarians-coronavirus-comment/","NRW's Laschet walks back 'Romanians and Bulgarians' coronavirus comment - Society of European Journalists","NULL","none","bulgarian",0,0,0,0
