"","ID","URL","Title","body","Country","Group","Protest","Protest_Typ","Discrim","Discrim_Type"
"1",2,"https://www.eaglenews.ph/bulgarianspatiencerunsdryoverwatercrisis/","Bulgarians' patience runs dry over water crisis","NULL","BUL","bulgarian",1,1,0,0
"2",7,"https://www.france24.com/en/20200129bulgarianspatiencerunsdryoverwatercrisis","Bulgarians' patience runs dry over water crisis  France 24","NULL","BUL","bulgarian",1,1,0,0
"3",12,"https://urboapp.com/bg/e2401ij","Bulgarians vs Aliens * Standup comedy in English * Gramophone club","","BUL","bulgarian",0,0,0,0
"4",17,"https://www.novinite.com/articles/202536/Bulgarians+Mark+172+Years+since+the+Birth+of+Hristo+Botev","Bulgarians Mark 172 Years since the Birth of Hristo Botev  Novinite.com  Sofia News Agency","HOT: » Greek Ambassador: Bulgaria is our Most Important Economic and Trade partner in the Region #AmbassadorTalks  On January 6, Bulgaria marks 172 years since the birth of the Bulgarian poet and revolutionary Hristo Botev. Celebrations will take place across the country, BNT reported. In many places in the country, together with marking Botev’s birth, church celebrations will be held for water blessings of the military units and flags, which will be followed by the ceremony for retrieving the cross from rivers on Epiphany. Celebrations to mark Hristo Botev’s birth will take place in his birth town of Kalofer, in Sofia, Stara Zagora, Plovdiv, Haskovo, Blagoevgrad, Veliko Turnovo, Varna and Burgas. Botev was born in Kalofer in 1848. His father was a teacher and one of the most significant figures in the late period of the Bulgarian National Revival. In 1863, after completing his elementary education in Kalofer, Botev was sent by his father to a high school in Odessa, where he studied for 2 years. During this period, his ties to the Russian revolutionary movement and his political views began to form. In 1867, he returned to Kalofer to teach in place of his ill father. In May, he made a public speech against the Ottoman authorities, which led to his exile and move to Romania seeking asylum. From 1869 to 1871, Botev worked again as a teacher in Bessarabia, keeping close relations with the Bulgarian revolutionary movement and its leaders. In June 1871, he became editor of the revolutionary emigrant newspaper ""Word of the Bulgarian Emigrants"", where he published early poetic works. He closely collaborated with the Russian revolutionists and worked for the Russian newspaper Svoboda (Liberty). In 1873, he worked on the satiric newspaper “Alarm Clock” and published political fiction aimed at wealthy Bulgarians. He continued to write poetry with themes such as revolutionary zeal and freedom, with two of his more famous poems being, “In the Tavern” and “My Prayer”. After the outbreak of the 1876 April Uprising, which had the goal to liberate Bulgaria from the five-century Ottoman rule, Botev began organising a troupe to enter Bulgaria and help the rebels. On 30th of May, 1876, Botev and part of the troupe seized a ship and re-entered Bulgaria from Romania near Kozloduy. Hristo Botev was killed on 1st of June 1876. Since his death, many streets, cities and landmarks have been named after the revolutionary, including “Botev Point”, “Botev Peak”, and “Botevgrad”. A football stadium in the South Bulgarian city of Plovdiv was named “Hristo Botev” in 1961 and is home to the professional football club “Botev Plovdiv”. We need your support so Novinite.com can keep delivering news and information about Bulgaria! Thank you! Google Street View is again on its way through Bulgaria Bulgaria has the Largest Gray Economy in Europe","BUL","bulgarian",1,1,0,0
"5",20,"https://www.novinite.com/articles/202614/PM+Borissov+Hopes+that+Bulgarians+will+be+able+to+Travel+to+the+US+without+Visa+within+a+Year+and+a+Half","PM Borissov Hopes that Bulgarians will be able to Travel to the US without Visa within a Year and a Half","HOT: » Greek Ambassador: Bulgaria is our Most Important Economic and Trade partner in the Region #AmbassadorTalks  In February or March, the Assistant Secretary of State for Consular Affairs will visit Bulgaria to discuss the issue of The Visa Waiver Program with the United States. This was made clear during the meeting between Prime Minister Boyko Borissov and US Ambassador Herro Mustafa. This morning they opened the first session of the Bulgaria-US Strategic Dialogue with the with the participation of an American delegation. Borisosv expressed hope that the issue of visas would be resolved within a year or so. ""So far, the Bulgarian side has asked the question. For the first time, the issue of visa waivers was raised by President Trump. Borissov said. Last year, Deputy Prime Minister and Minister of Foreign Affairs Ekaterina Zaharieva and U.S. Deputy Assistant Secretary Matthew Boyse discussed in Sofia the strategic partnership with the United States. Minister Zaharieva reaffirmed the country's desire to continue constructive cooperation in the spirit of the agreements reached during Prime Minister Boyko Borissov's visit to Washington in November. Important priorities in bilateral relations for Bulgaria remain inclusion in the US Visa Waiver Program, as well as support for the start of negotiations for Bulgaria's membership in the Organization for Economic Cooperation and Development, Zaharieva added. We need your support so Novinite.com can keep delivering news and information about Bulgaria! Thank you! Google Street View is again on its way through Bulgaria Bulgaria has the Largest Gray Economy in Europe","BUL","bulgarian",0,0,0,0
"6",21,"https://www.novinite.com/articles/202515/Bulgarians+Don%27t+EatOut+Much","Bulgarians Don't EatOut Much  Novinite.com  Sofia News Agency","HOT: » Greek Ambassador: Bulgaria is our Most Important Economic and Trade partner in the Region #AmbassadorTalks  In 2018, households in the European Union (EU) spent over €600 bn (equivalent to 3.8% of EU GDP) on 'catering services', i.e. restaurants, cafés, canteens, and the like, Eurostat reported. Household expenditure on catering services represents 7.0% of their total consumption expenditure. The share of household expenditure devoted to catering services was largest in Ireland (14.4%), ahead of Spain (13.0%), Malta (12.6%) and Greece (12.4%, 2017 data). In contrast, the lowest share was recorded in Romania (1.9%), followed by Poland (3.0%) and Lithuania (3.4%). Lithuania - highest decrease in catering services expenditure, Romania the highest increase Between 2008 and 2018, the share of total household expenditure on catering services increased in most EU Member States where 2018 data is available. The largest increase was recorded in Malta (from 8.2% of total household expenditure in 2008 to 12.6% in 2018, or an increase of 4.4 percentage points (pp)), followed by Ireland (+2.9 pp) and Hungary (+2.5 pp). In contrast, household expenditure on catering services decreased in 4 EU Member States where 2018 data is available. The largest decrease was recorded in Romania (from 2.9% in 2008 to 1.9% in 2018, or a decrease of 1.0 pp), Spain (-0.8 pp), Slovakia (-0.5 pp) and the United Kingdom (-0.2 pp), while it remained stable in Luxembourg.  Picture Source: Eurostat We need your support so Novinite.com can keep delivering news and information about Bulgaria! Thank you! Google Street View is again on its way through Bulgaria Bulgaria has the Largest Gray Economy in Europe","BUL","bulgarian",0,0,0,0
"7",23,"https://sofiaglobe.com/2020/01/31/zaharievaonbrexitbulgariansinukwillnotfeeladifferencetomorrow/","Zaharieva on Brexit: ‘Bulgarians in UK will not feel a difference tomorrow’","NULL","none","bulgarian",0,0,0,0
"8",33,"https://sofiaglobe.com/2020/01/13/lessthanhalfofbulgariansareawareofeupassengerrightspoll/","Less than half of Bulgarians are aware of EU Passenger Rights – poll","NULL","BUL","bulgarian",0,0,0,0
"9",39,"https://news.yahoo.com/bulgarianspatiencerunsdryoverwatercrisis143627291.html","Bulgarians' patience runs dry over water crisis","NULL","BUL","bulgarian",0,0,0,0
"10",43,"https://www.novinite.com/articles/202487/NSI%3A+Travels+of+Bulgarians+abroad+in+November+2019+2.8+higher+than+in+November+2018","NSI: Travels of Bulgarians abroad in November 2019 2.8% higher than in November 2018  Novinite.com  Sofia News Agency","HOT: » Greek Ambassador: Bulgaria is our Most Important Economic and Trade partner in the Region #AmbassadorTalks  In November 2019, the number of trips of Bulgarian residents abroad was 438.3 thousand or by 2.8% above the registered in November 2018, the National Statistical Institute said in a press release. In comparison with the same month of the previous year, an increase was observed in the total number of the trips of Bulgarians to: Austria - by 12.6%, Germany - by 11.0%, Turkey - by 4.5%, Republic of North Macedonia - by 3.8%, Serbia - by 2.4%, Italy - by 1.1%. At the same time, there was a decrease of the trips to: Russian Federation - by 10.2%, Romania - by 2.5%, Greece - by 2.2%, and etc. In comparison with November 2018, an increase in trips with all purposes was registered: ‘holiday and recreation’ - by 7.5%, ‘professional’ - by 2.4%, and ‘others’ - by 0.5%. The trips with other purposes (as a guest, education, visiting cultural and sport events) in November 2019 composed the greatest share of the total number of trips of Bulgarian residents abroad - 45.0%, followed by those with professional purpose - 28.2%, and with holiday and recreation purposes - 26.8%. In November 2019 most trips of Bulgarian citizens were made to: Turkey - 127.4 thousand, Greece - 72.2 thousand, Romania - 39.7 thousand, Serbia - 33.9 thousand, Germany - 24.3 thousand, Republic of North Macedonia - 21.7 thousand, Austria - 17.2 thousand, Italy - 16.0 thousand, the United Kingdom - 13.8thousand, Spain - 10.3 thousand. In November 2019 most trips of Bulgarian citizens were made to: Turkey - 127.4 thousand, Greece - 72.2 thousand, Romania - 39.7 thousand, Serbia - 33.9 thousand, Germany - 24.3 thousand, Republic of North Macedonia - 21.7 thousand, Austria - 17.2 thousand, Italy - 16.0 thousand, the United Kingdom - 13.8thousand, Spain - 10.3 thousand. In November 2019, the number of arrivals of visitors from abroad to Bulgaria was 609.7 thousand, or by 6.0% more in comparison with November 2018. An increase in the trips with all purposes was registered: ‘holiday and recreation’- by 9. 1%, ‘others’ (including as guest or transit) - by 5.7% and ‘professional’ - by 1.7%. Transits through the country were 27.5% (167.5 thousand) of all visits of foreigners to Bulgaria. The share of visits of ЕU citizens was 51.5% of the total number of foreigners’ visits to Bulgaria in November 2019 or by 0.4% less in comparison with the same month of the previous year. A decrease was registered in the visits of citizens from Austria - by 5.8%, Greece - by 5. 7%, the Netherlands - by 1.8%, Romania - by 1.3%, and etc. At the same time, there was an increase in visits from the United Kingdom - by 19.0%, Italy - by 13.6%, Germany - by 10.2%, Poland - by 7.9%, France - by 3.0%. The visits of foreigners in the group ‘Other European countries’ increased by 13.6%, and the highest increase was observed in the visits of citizens of Turkey - by 25.1%. In November 2019, the predominant share of the visits with other purposes was 47.3%, followed by trips with holiday and recreation purpose - 32.9%, and with professional purpose - 19.8% (Figure 5). In November 2019, the most visits to Bulgaria were from: Romania - 128.5 thousand, Turkey - 109.6thousand, Greece - 88.7 thousand, Serbia - 53.2 thousand, Republic of North Macedonia - 45.6 thousand, Ukraine - 18.7 thousand, Germany - 16.7 thousand, the United Kingdom - 13.6 thousand, Italy - 12.2 thousand, Poland - 9.8 thousand.  We need your support so Novinite.com can keep delivering news and information about Bulgaria! Thank you! Google Street View is again on its way through Bulgaria Bulgaria has the Largest Gray Economy in Europe","BUL","bulgarian",0,0,0,0
"11",44,"https://www.novinite.com/articles/202897/Turkey%2C+Greece+and+Germany+are+the+Most+Preferred+Destinations+for+Bulgarians+in+December","Turkey, Greece and Germany are the Most Preferred Destinations for Bulgarians in December  Novinite.com  Sofia News Agency","HOT: » Greek Ambassador: Bulgaria is our Most Important Economic and Trade partner in the Region #AmbassadorTalks  In December 2019, the number of the trips of Bulgarian residents abroad was 529.3 thousand or by 10.6% above the registered in December 2018. In comparison with the same month of the previous year, an increase was observed in the total number of the trips of Bulgarians to: Serbia - by 28.6%, Romania - by 16.5%, Turkey - by 15.9%, Germany - by 12.9%, Republic of North Macedonia - by 8.2%, Greece - by 2.8%, and etc. At the same time decreased the trips to: France - by 6.3%, Sweden - by 4.3%, Slovenia - by 2.4%, and etc, the National Statistical Institute (NSI) reported. In comparison with December 2018, an increase in the trips with all observed purposes was registered: ‘holiday and recreation’ - by 14.4%, ‘professional’ - by 12.6%, and ‘others’ - by 7.6%. The trips with other purposes (as a guest, education and visit the cultural and sport events) in December 2019 composed the greatest share of the total number of trips of Bulgarian residents abroad - 48.1%, followed by those with holiday and recreation purposes - 28.5%, and with professional purpose - 23.4%. In December 2019 most trips of Bulgarian citizens were made to: Turkey - 130.1 thousand, Greece - 91.3 thousand, Germany - 46.6 thousand, Serbia - 46.4 thousand, Romania - 39.9 thousand, Republic of North Macedonia - 35.5 thousand, Italy - 18.1 thousand, Austria - 17.7 thousand, the United Kingdom - 12.1 thousand, Spain - 11.8 thousand We need your support so Novinite.com can keep delivering news and information about Bulgaria! Thank you! Google Street View is again on its way through Bulgaria Bulgaria has the Largest Gray Economy in Europe","BUL","bulgarian",0,0,0,0
"12",45,"https://www.thebaghdadpost.com/en/Story/45688/Bulgariansprotestseverewatershortageinindustrialcity","Bulgarians protest severe water shortage in industrial city","NULL","none","none",0,0,0,0
"13",47,"https://www.thestar.com/news/world/europe/2020/01/25/bulgariansprotestseverewatershortageinindustrialcity.html","Bulgarians protest severe water shortage in industrial city | The Star","NULL","BUL","bulgarian",1,2,0,0
"14",50,"http://goacom.com/policearrest2bulgariansforattemptedatmfraud/","Police arrest 2 Bulgarians for attempted ATM fraud","NULL","none","none",0,0,0,0
"15",53,"https://www.youtube.com/watch?v=ZFTH1WcbKdw","Beastly Bulgarians | FM20 | Build a Nation Challenge | Ep 45 | SEMI TIME","","none","none",0,0,0,0
"16",54,"https://technewstube.com/theregister/1198843/nottrueonewantsukdomainslookbulgarianssigned/","It’s not true no one wants .uk domains – just look at all these Bulgarians who signed up to nab expired addresses","","none","bulgarian",0,0,0,0
"17",64,"http://www.naharnet.com/stories/en/268643","Bulgarians' Patience Runs Dry over Water Crisis"," Forced to ""live without water, in the 21st century, in a European Union country"": Bulgarian Yana Stoyanova is not bemoaning climate change, but the incompetence of the authorities which has left some 100,000 people with an acute water shortage. Accountant Stoyanova does not live in an isolated backwater, but around 30 kilometers (19 miles) from the capital Sofia. She is at the sharp end of a crisis which has led to the environment minister being charged with mismanagement and forced to resign. It also prompted a parliamentary vote of no confidence on Wednesday in the government -- which it survived. But the scandal has fed public anger at the failures of those running the EU's poorest country. The western Bulgarian city of Pernik should have a plentiful supply of water from the nearby Studena dam. However, the reservoir there is practically empty, with most of the bed now lying exposed. Pernik residents meanwhile are receiving murky, undrinkable water -- and even that only between 4pm and 10pm (1400-2000 GMT). For three months now, the daily routine for 36-year-old Stoyanova and her electrical engineer husband has revolved around the shortage. ""When we get back from work at 7pm, we run to take a shower and try to wash everything before 10pm,"" she explains, with buckets and containers being filled before the taps run dry. ""I try to cook with mineral water, I wash dishes with it and of course I only drink mineral water,"" says 56-year-old Adelina Ivanova, who has to haul the bottles up seven flights of stairs. ""The meaning of your life in a given day is: 'Will I manage to take a shower?', and being so happy when you do,"" Ivanova says. ""It's absurd for a civilized person to be reduced to that."" - 'Corruption, not climate' - Bulgaria has had a drier winter than normal and during 2019 received 25 percent less rainfall than average, in what was the second-hottest year on record. But residents are clear on where they place the blame for the crisis. ""We are victims of negligence and corruption, not the climate,"" sighs 67-year-old Ivan Dragov, who used to work in the area's water distribution network. Prosecutors accuse the former Environment and Water Minister Neno Dimov of ignoring warnings about the falling water levels at the reservoir, as well as continuing to allow a local steelworks to draw water from it. ""Thirty years ago, around a dozen businesses were operating in the area and the water level was monitored daily,"" says Dragov, adding that there were no shortages for residents back then. Pernik's former mayor has also been charged with abuse of power over her refusal to enforce rationing during her campaign for re-election last autumn -- which she went on to lose anyway. On Saturday, hundreds of residents took their anger to government headquarters in Sofia, shouting ""resign!"", ""killers!"" and ""Mafia!"" - 'Bottomless barrel' - The crisis in Pernik has also thrown a spotlight on Bulgaria's dilapidated water infrastructure, which results in around 60 percent of water being lost through leaks. In Pernik, the pipes date from the 1960s and 70s and the losses can reach up to 75 percent. The new Environment Minister Emil Dimitrov has compared the network to a ""bottomless barrel"". The leaks leave up to 315,000 people -- in a country of seven million -- facing regular water shortages, particularly in summer. The government has said that cutting down on these losses is a priority, and has pledged 900 million euros ($990 million) to renew this infrastructure in the next two years. However, the total cost of bringing it up to scratch is estimated at six billion euros. If the situation in Pernik does not improve, authorities have warned that water could run out completely by April. Even to maintain the current six hours of daily supply, the government is having to divert water from another reservoir, with 13 kilometers of pipes still needing to be installed to complete the link. As for Stoyanova, the crisis has only confirmed her bleak opinion of her country's situation. She is encouraging her daughters, aged 5 and 9, to learn English. ""They don't have a future here. We're preparing them to leave Bulgaria as soon as they're adults."" Login using your Naharnet account","BUL","bulgarian",1,1,0,0
"18",66,"https://today.rtl.lu/news/scienceandenvironment/a/1463392.html","Acute water shortage: Bulgarians' patience runs dry over water crisis","The western Bulgarian city of Pernik should have a plentiful supply of water from the nearby Studena dam, but the reservoir there is practically empty / © AFP Forced to ""live without water, in the 21st century, in a European Union country"": Bulgarian Yana Stoyanova is not bemoaning climate change, but the incompetence of the authorities which has left some 100,000 people with an acute water shortage. Accountant Stoyanova does not live in an isolated backwater, but around 30 kilometres (19 miles) from the capital Sofia. She is at the sharp end of a crisis which has led to the environment minister being charged with mismanagement and forced to resign. It also prompted a parliamentary vote of no confidence on Wednesday in the government -- which it survived. But the scandal has fed public anger at the failures of those running the EU's poorest country. The western Bulgarian city of Pernik should have a plentiful supply of water from the nearby Studena dam. However, the reservoir there is practically empty, with most of the bed now lying exposed. Pernik residents are at the sharp end of a crisis which has led to the environment minister being charged with mismanagement and forced to resign / © AFP Pernik residents meanwhile are receiving murky, undrinkable water -- and even that only between 4pm and 10pm (1400-2000 GMT). For three months now, the daily routine for 36-year-old Stoyanova and her electrical engineer husband has revolved around the shortage. ""When we get back from work at 7pm, we run to take a shower and try to wash everything before 10pm,"" she explains, with buckets and containers being filled before the taps run dry. ""I try to cook with mineral water, I wash dishes with it and of course I only drink mineral water,"" says 56-year-old Adelina Ivanova, who has to haul the bottles up seven flights of stairs. ""The meaning of your life in a given day is: 'Will I manage to take a shower?', and being so happy when you do,"" Ivanova says. ""It's absurd for a civilised person to be reduced to that."" - 'Corruption, not climate' - Bulgaria has had a drier winter than normal and during 2019 received 25 percent less rainfall than average, in what was the second-hottest year on record. But residents are clear on where they place the blame for the crisis. Adelina Ivanova has to haul bottles of mineral water up seven flights of stairs / © AFP ""We are victims of negligence and corruption, not the climate,"" sighs 67-year-old Ivan Dragov, who used to work in the area's water distribution network. Prosecutors accuse the former Environment and Water Minister Neno Dimov of ignoring warnings about the falling water levels at the reservoir, as well as continuing to allow a local steelworks to draw water from it. ""Thirty years ago, around a dozen businesses were operating in the area and the water level was monitored daily,"" says Dragov, adding that there were no shortages for residents back then. Pernik's former mayor has also been charged with abuse of power over her refusal to enforce rationing during her campaign for re-election last autumn -- which she went on to lose anyway. On Saturday, hundreds of residents took their anger to government headquarters in Sofia, shouting ""resign!"", ""killers!"" and ""Mafia!"" - 'Bottomless barrel' - The crisis in Pernik has also thrown a spotlight on Bulgaria's dilapidated water infrastructure, which results in around 60 percent of water being lost through leaks. In Pernik, the pipes date from the 1960s and 70s and the losses can reach up to 75 percent. The new Environment Minister Emil Dimitrov has compared the network to a ""bottomless barrel"". The leaks leave up to 315,000 people -- in a country of seven million -- facing regular water shortages, particularly in summer. The government has said that cutting down on these losses is a priority, and has pledged 900 million euros ($990 million) to renew this infrastructure in the next two years. However, the total cost of bringing it up to scratch is estimated at six billion euros. If the situation in Pernik does not improve, authorities warn that water could run out completely by April / © AFP If the situation in Pernik does not improve, authorities have warned that water could run out completely by April. Even to maintain the current six hours of daily supply, the government is having to divert water from another reservoir, with 13 kilometres of pipes still needing to be installed to complete the link. As for Stoyanova, the crisis has only confirmed her bleak opinion of her country's situation. She is encouraging her daughters, aged 5 and 9, to learn English. ""They don't have a future here. We're preparing them to leave Bulgaria as soon as they're adults.""","BUL","bulgarian",1,1,0,0
