"","ID","URL","Title","body","Country","Group","Protest","Protest_Typ","Discrim","Discrim_Type"
"160",445,"https://www.rferl.org/a/bulgarians0gather0for064th0day0of0anti0government0protests0demand0resignations/30832766.html","Bulgarians Gather For 64th Day Of Anti0Government Protests, Demand Resignations","Print SOFIA -- Anti-government protesters returned to the streets of the Bulgarian capital, Sofia, pressing demands for the resignation of the government and the prosecutor-general. The rally on September 10 marked the 64th consecutive day of protests against the ruling conservative GERB party and its government in the Southeastern European nation’s deepening political crisis. Protesters, monitored closely by police, gathered outside the National Assembly building in Sofia, shouting, “Mafia out!” and demanding the resignation of Prime Minister Boyko Borisov’s government and Prosecutor-General Ivan Geshev. The September 10 rally appeared to take place without major incident. On September 2-3, several thousand people joined the so-called Grand National Uprising in response to what protesters say is oligarchic control over Bulgaria’s government and judicial system. Violence on that day led to scores of injuries and the arrest of 126 people, including what police described as more than 60 football hooligans. Opinion polls show that more than 60 percent of Bulgarians support demands for Borisov and Geshev to resign and for immediate parliamentary elections to be called. Borisov has said he is prepared to step down following parliamentary elections currently set for March 2021. On July 21, Borisov’s government survived a no-confidence vote in parliament, the fifth such vote since it took power in 2017. The demonstrators have protested against Borisov's government over perceived ties to the country’s powerful oligarchs. They also claim that Geshev has targeted government critics, including Socialist-backed President Rumen Radev, who has supported the protests. The protests were sparked by a raid on July 9 by the Prosecutor-General's Office on the presidential headquarters. Radev’s legal affairs and anti-corruption secretary and his security and defense adviser were detained for questioning and their offices searched as part of two separate probes into alleged influence-peddling and disclosure of state secrets. The demonstrators have condemned the raids as an attack by the government and the prosecutor-general against Radev. Radev has often criticized Borisov's government for doing too little to uproot endemic corruption and has blasted prosecutors for cherry-picking their probes and colluding with the government. Bulgaria is the European Union’s poorest country and remains corruption-ridden, according to Transparency International's corruption perception index.   RFE/RL’s Bulgarian Service relaunched in 2019 after a 15-year absence, providing independent news and original analysis to help strengthen a media landscape weakened by the monopolization of ownership and corruption.   Radio Free Europe/Radio Liberty © 2023 RFE/RL, Inc. All Rights Reserved.","BUL","bulgarian",1,3,0,0
"161",446,"https://www.europeana.eu/en/blog/bulgarians0heroes0the0first0gymnastics0societies0in0bulgaria","Bulgarians, heroes! The first gymnastics societies in Bulgaria","In Krakow, Poland, making nativity scenes is seen as a cultural tradition going back centuries. Objects and craft of desire, from India to Europe The life and legacy of a Dutch chess legend Renowned scholar of the Romanian Greek-Catholic Church Visionary architect who designed many landmarks in the Netherlands World Collage Day is an annual international celebration of collage on the Second Saturday of May. This an excellent opportunity to learn more about this technique, explore cultural heritage collections and get creative. Architecture crossing cultures Painting the beauty of everyday life The history of a floral motif over several centuries Pioneering female scientist in 18th century Bologna The first woman to convert to Islam in Liverpool Women of wisdom and courage Female pioneers of electronic music Documenting the The Great Depression and Japanese American internment Making contributions to both art and science Artist, designer and pioneer of the Glasgow Style Forging a path for Irish designers Photographer documenting two decades in a Finnish town The lesbian love story at the heart of a Parisian bookstore","BUL","bulgarian",0,0,0,0
"162",447,"https://bnr.bg/en/post/101337104/bulgarians0placed0under0quarantine0in0belgium0due0to0system0error","Bulgarians placed under quarantine in Belgium due to system error","   ""I believe in the power of real justice, I believe in the standard procedures of parliament and I hope that by following them we will achieve real justice. We shall not allow the prosecution to be used as a bludgeon."" This was what.. On Thursday morning there will be low visibility in the valleys and lowlands. It will be sunny during the day. Clouds will form over the mountains and Western Bulgaria in the afternoon hours with a chance of local showers. The lowest temperatures.. Relatives of people who died in road accidents staged a protest in front of the Sofia Court House and later in front of the National Assembly. The protest began with a minute's silence in memory of the perished. Protesters called for legislative..     The chairman of the State Agency for National Security (SANS) Plamen Tonchev announced at his hearing in the parliament today about an established case.. The caretaker cabinet is proposing, to the National Assembly, an extension of the budget 2022 extension law, until a new state budget for the current.. The Supreme Administrative Court of Bulgaria has definitively refused Russian opposition activist and opponent of Russia’s war against Ukraine.. english@bnr.bg +359 2 9336 661 ","none","bulgarian",0,0,0,0
"163",448,"https://www.youtube.com/watch?v=ZMT5ReFVLWA","<U+F4A3>C4SQUAD On Tour <U+F4A3> <U+041F><U+043E><U+0434><U+0430><U+0440><U+044F><U+0432><U+0430><U+043C><U+0435> <U+0442><U+0435><U+043D><U+0438><U+0441><U+043A><U+0438> <U+043D><U+0430> LUCIANO <U+0438> <U+043D><U+0430> BONEZ MC / <U+F1E7><U+F1EC> ORIGINAL BULGARIANS <U+F1E7><U+F1EC> [<U+0421><U+0435><U+0437><U+043E><U+043D> 1]","","none","bulgarian",0,0,0,0
"164",450,"https://bnr.bg/en/post/101336763/president0and0pm0congratulate0bulgarians0on0national0unification0day","President Radev and PM Borissov congratulate Bulgarians on Unification Day"," On the occasion of the 135th anniversary since the Unification of the Principality of Bulgaria with Eastern Rumelia, President Rumen Radev stressed, speaking to reporters, that “the historical lesson to be learnt from Unification Day is that a change for the better is possible when we are united in upholding freedom, justice and equality before the law.” In an address on social media Prime Minister Boyko Borissov states that Unification is a remarkable achievement of Bulgarian society. “I believe in the wisdom of the Bulgarian people! I believe that we, the citizens of Bulgaria will once again be able to come together around one national cause and embark on the path that is right for the country,” Boyko Borissov writes.   ""I believe in the power of real justice, I believe in the standard procedures of parliament and I hope that by following them we will achieve real justice. We shall not allow the prosecution to be used as a bludgeon."" This was what.. On Thursday morning there will be low visibility in the valleys and lowlands. It will be sunny during the day. Clouds will form over the mountains and Western Bulgaria in the afternoon hours with a chance of local showers. The lowest temperatures.. Relatives of people who died in road accidents staged a protest in front of the Sofia Court House and later in front of the National Assembly. The protest began with a minute's silence in memory of the perished. Protesters called for legislative..     The chairman of the State Agency for National Security (SANS) Plamen Tonchev announced at his hearing in the parliament today about an established case.. The caretaker cabinet is proposing, to the National Assembly, an extension of the budget 2022 extension law, until a new state budget for the current.. The Supreme Administrative Court of Bulgaria has definitively refused Russian opposition activist and opponent of Russia’s war against Ukraine.. english@bnr.bg +359 2 9336 661 ","BUL","bulgarian",0,0,0,0
"165",453,"https://bnr.bg/en/post/101347501/bulgarians0trust0in0eu0goes0up0in0government0down0eurofound0survey","Bulgarians’ trust in EU goes up, in government 0 down: Eurofound survey"," In Bulgaria trust in the EU has gone up from 4 to 4.5 out of 10 in the period from April to July. However, Bulgarians firmly give the government poor marks for its support during the crisis – from 3.3 in April down to 2.9 out of 10 in July. Poland is the only country where trust in the government is lower than it is in Bulgaria – 2.6-2.4, though trust in the EU is considerably higher – 5.1-6.2. The survey is by the EU agency Eurofound which focuses on societal change and trust in institutions. Trust in the EU has gone up, on average, from 4.6 in April to 5.1 in July, whereas the average level of trust in national governments has dropped from 4.8 to 4.6 out of 10, BGNES reports.   ""I believe in the power of real justice, I believe in the standard procedures of parliament and I hope that by following them we will achieve real justice. We shall not allow the prosecution to be used as a bludgeon."" This was what.. On Thursday morning there will be low visibility in the valleys and lowlands. It will be sunny during the day. Clouds will form over the mountains and Western Bulgaria in the afternoon hours with a chance of local showers. The lowest temperatures.. Relatives of people who died in road accidents staged a protest in front of the Sofia Court House and later in front of the National Assembly. The protest began with a minute's silence in memory of the perished. Protesters called for legislative..     The chairman of the State Agency for National Security (SANS) Plamen Tonchev announced at his hearing in the parliament today about an established case.. The caretaker cabinet is proposing, to the National Assembly, an extension of the budget 2022 extension law, until a new state budget for the current.. The Supreme Administrative Court of Bulgaria has definitively refused Russian opposition activist and opponent of Russia’s war against Ukraine.. english@bnr.bg +359 2 9336 661 ","BUL","bulgarian",0,0,0,0
"166",454,"https://cde.news/borissov0to0face0new0pressure0from0bulgarians/","Borissov to face new pressure from Bulgarians","NULL","BUL","bulgarian",1,3,0,0
"167",456,"http://redpilledreality.com/bulgarians0are0revolting0against0the0corrupt0elites0who0have0looted0that0country/","Bulgarians Are Revolting Against The Corrupt Elites Who Have Looted That Country 0 Redpilled Reality","","BUL","bulgarian",1,3,0,0
"168",458,"https://yespunjab.com/30bulgarians0among050nabbed0in0atm0card0skimming0scam/","3 Bulgarians among 5 nabbed in ATM card skimming scam","NULL","none","none",0,0,0,0
"169",459,"https://www.cambridge.org/core/books/holocaust0in0greece/bulgarians0were0the0worst0reconsidering0the0holocaust0in0salonika0within0a0regional0history0of0mass0violence/C5EA84C6B79DD4BAF82929D958302409","“The Bulgarians Were the Worst!” Reconsidering the Holocaust in Salonika within a Regional History of Mass Violence (Chapter 2)","We use cookies to distinguish you from other users and to provide you with a better experience on our websites. Close this message to accept cookies or find out how to manage your cookie settings. Published online by Cambridge University Press: 26 October 2018 Loading... To save this book to your Kindle, first ensure coreplatform@cambridge.org is added to your Approved Personal Document E-mail List under your Personal Document Settings on the Manage Your Content and Devices page of your Amazon account. Then enter the ‘name’ part of your Kindle email address below. Find out more about saving to your Kindle. Note you can select to save to either the @free.kindle.com or @kindle.com variations. ‘@free.kindle.com’ emails are free but can only be saved to your device when it is connected to wi-fi. ‘@kindle.com’ emails can be delivered even when you are not connected to wi-fi, but note that service fees apply. Find out more about the Kindle Personal Document Service. To save content items to your account, please confirm that you agree to abide by our usage policies. If this is the first time you use this feature, you will be asked to authorise Cambridge Core to connect with your account. Find out more about saving content to Dropbox. To save content items to your account, please confirm that you agree to abide by our usage policies. If this is the first time you use this feature, you will be asked to authorise Cambridge Core to connect with your account. Find out more about saving content to Google Drive.","none","bulgarian",0,0,0,0
"170",470,"https://www.youtube.com/watch?v=N_mpvlz3yQo","1v1 Migration | Bulgarians vs Turks","","none","none",0,0,0,0
"171",473,"https://www.youtube.com/watch?v=41QszkTJN9g","Six Dead Bulgarians   Dont touch this","","none","bulgarian",0,0,0,0
"172",474,"http://macedonia.kroraina.com/bugarash/bginus/mbinus.html","Macedonian Bulgarians in the United States","      Memoir Respectfully Submitted by the Macedono-Bulgarian Central Committee Representing Forty Thousand Bulgarians from Macedonia in the United States of America, to the President of the United States of America, and to the Governments of the Allied and Neutral Powers of Europe and Their Representatives at the Peace Conference, Paris, France. Here is part of the text: ""A resolution by the Macedono-Bulgarian Congress conducted on December 1-6, 1918 in Chicago for the freedom of Macedonia and the unification of the Bulgarian people. ...... We, the undersigned 200 delegates, representing 40 000 Bulgarians from Macedonia, present the following facts: ""1. We are born, grown up and brought up in the cities and villages of Macedonia, where we used to live: Skopie, Tetovo, Debar, Ohrid, Kostur, Lerin, Voden, Bitolja, Prilep, Veles, Gevgeli, Dojran, Kukush, Radovish, Maleshevo, Shtip, Kochani, Kratovo, Kumanovo, Palanka, Demir Hisar, Serres, Drama, Resen, Tikvesh, Struga, Enidje-Vardar, Solun and others, which are currently under Greek and Serbian slavery... 3. We are part of that population, whose fathers and children had fought against the Greek religious yoke and had been the creators of our church organisation the Bulgarian Exarchate much before the Bulgarian Kingdom was created. 4. We are just a small part of the 1, 200, 000 Slav inhabitants of Macedonia, who speak no other language but Bulgarian... ... ...we politely ask that our native land be included in the borders of our common Fatherland, thus preventing a policy of partition and tearing apart of our native land."" 2. Stilton. The members of the Bulgarian Mecedono-Odrinian Organization. See the enormous Bulgarian flag.  3. The celebration of the St. St. Cyrill and Methodius day in Madison, Illinois, 1920. The Bulgarian flag is proudly raised as a symbol of the national affiliation of the early emigration.  4. The laying of the foundation stone of the Bulgarian church in Stilton, Pennsylvania in 1909. To the right is seen the Bulgarian flag.  6 . The ""Liberty"" newspaper was the press organ of the Macedono-Bulgarian National Alliance..   7. Trayan Andreeff Murdzheff from the village of Giavato, Bitolja, with a parade uniform. On his chest he has a Bulgarian-flag ribbon. 8. À Bulgarian amateur theater group giving the play ""Macedonian Bloody Wedding"". Behind them is the Bulgarian flag. 10. ""Bulgarian Balkan Band"" - founded in 1915 in Stilton, Pennsylvania. Most of its members were from Prilep, Macedonia.  11. The ""Macedonia"" newspaper was the fifth Bulgarian newspaper in the US. It was issued weekly in Granite city from 1907 to 1910.  12. April 23, 1942: OSS report on various American Slavic groups. In 1942 as a mean to build up pro-Allied sentiment among America's various Eastern European immigrant communities, a ""Slav Congress"" was held, with delegations arriving from the most prominent groups. Office of Strategic Services informant ""SK"" attended and reported on internal dissension behind the scenes. In the report the population of Macedonia is reffered to as ""Macedonian Bulgarians"".   13. Here you can see examples of newspaper advertisements of the Macedonian Bulgarians in the US from the beginning of the 20th century.   14. Resident Alien's Border Crossing Identification Cards issued in 1947 by the Immigration and Naturalization Service of the U.S. Department of Justice.    15. 1910 Census in the US - Instructions to Enumerators: ... 137. Do not write ""Macedonian,"" but write Bulgarian, Turkish, Greek, Servian, or Roumanian, as the case may be. ... Taken from here.    Links: ","none","bulgarian",0,0,0,0
"173",476,"https://www.youtube.com/watch?v=mYpvWxJa5mc","The Serbians defeat the Bulgarians (1916)","","none","bulgarian",0,0,0,0
"174",480,"https://www.youtube.com/watch?v=_zXhhTIXn4E","Are Bulgarians the nicest Europeans?!","","none","bulgarian",0,0,0,0
"175",485,"https://sofiaglobe.com/2020/10/01/poll0560of0bulgarians0believe0official0information0about0covid019/","Poll: 56% of Bulgarians believe official information about Covid019","NULL","BUL","bulgarian",0,0,0,0
"176",490,"https://www.balcanicaucaso.org/eng/Areas/Bulgaria/Bulgarians0a0vanishing0people032347","Bulgarians, a vanishing people?","NULL","BUL","bulgarian",0,0,0,0
"177",494,"https://www.quora.com/Do0Bulgarians0understand0speak0Russian","Do Bulgarians understand/speak Russian?","NULL","BUL","bulgarian",0,0,0,0
"178",495,"https://steamcommunity.com/sharedfiles/filedetails/?id=2261720114","Steam Community :: Screenshot :: 3 achievements as greece in one run. Got a bit of turkey and germany. But bulgarians took my territory somehow..","","none","bulgarian",0,0,0,0
"179",497,"https://www.youtube.com/watch?v=5If188HxPpE","CRAZY GAME | Arabia Jordan (Chinese) vs TheMax (Bulgarians)","","none","bulgarian",0,0,0,0
"180",508,"https://www.youtube.com/watch?v=NbaOIb7PDgM","[ES] Defensive playstyle vs Bulgarians","","none","bulgarian",0,0,0,0
"181",519,"https://sofiaglobe.com/2020/11/20/covid0190bulgarians0among0least0supportive0of0restrictions0in0eu0survey0shows/","Covid019: Bulgarians among least supportive of restrictions in EU, survey shows","NULL","BUL","bulgarian",1,3,0,0
"182",522,"https://bnr.bg/en/post/101380826/bulgarians0arriving0in0uk0to0be0released0from0quarantine0with0negative0pcr0test0performed0after05th0day0of0self0isolation","Bulgarians arriving in UK can be released from quarantine","NULL","BUL","bulgarian",0,0,0,0
"183",525,"https://bnr.bg/en/post/101374915/what0bulgarians0living0in0the0uk0can0expect0after0brexit","What Bulgarians living in the UK can expect after Brexit"," When in the 1990s he arrived in Great Britain for a student summer job, he loved it so much that he made up his mind to go back and try his luck in Britain. Now, Atanas Chikov is one of the most active Bulgarians in the UK turning his desire to help other Bulgarians who want to settle and work there into his profession. That was how the platform BGhelp, http://www.bghelp.co.uk/forums/content/ came into being and grew to become a resounding success, with tens of thousands of Bulgarians registering on it. They exchange ideas, experience, advice, anyone can join in and do anything they can to help. Meanwhile Atanas created a series of Facebook pages on various topics connected with life in Britain, as well as a YouTube channel https://www.youtube.com/c/AtanasChikov/videos, to which he uploads videos with recommendations and valuable advice about local realities. Atanas became a licensed migration consultant. He says he can barely keep up with all of the questions and queries because after Brexit Bulgarians face a host of problems. There are more than 20,000 Bulgarians living in the UK. Atanas says many come with the idea of working for a few years, making some money and then going back home. Some start successful businesses or find a steady job and decide to stay. People work hard and pay their taxes, and that is something the UK also benefits from. But with all the Brexit-related problems and lack of information, many have been coming up against insurmountable administrative barriers: “There are a lot of problems,” Atanas says. “With the corona crisis some go to work, others work from home. But rent is high, and if at some point they are left out of a job, how can they afford to pay it? Or all the obstacles connected with the paperwork that will allow them to go on working after Brexit. Most Bulgarians have already obtained their new status but some face serious administrative problems. Other complications involve travelling and the expiry of the identity cards, because you can’t just fly back to Bulgaria to renew them.”  But the most serious apprehensions are connected with the uncertainty of Brexit – will there be a deal or not! Bulgarians worry how that will affect the exchange rate of the pound. “Many have been converting their salaries into euro and sending the money back home to relatives. But if there is no deal and the pound drops below one euro, that would really burn a hole in their pocket,” Atanas says. It is not at all clear where the British economy is going, and there is a risk of entire sectors being affected, like hotels and restaurants where 10-15% of all Bulgarians living in the UK are employed. Do Bulgarians find integration easy? “I don’t think so. The perspective on life here is different. We are the Southern type, we are more temperamental, like the Spanish or the Greek, we like to sit down at table and eat together, to listen to music… Britain is the perfect place to do business, to make some money, and then, if you want to, to go back home,” Atanas Chikov says. Photographs courtesy of Atanas Chikov   Residents and guests of Burgas can now take advantage of yet another attraction in the seaside city, which will introduce them to what is happening in the vast Cosmos. It is about the newly opened planetarium, located in the area of the Burgas-East port.. Turkiye to hold a presidential runoff on May 28 Turkiye will hold a presidential runoff on Sunday, May 28. This is the first time Erdogan faces a second-round run-off vote as a presidential candidate. The presidential race pits incumbent head.. On May 28 we celebrate the Day of Parks in Bulgaria. May 28 was declared the Day of Parks in Bulgaria by decision of the Ministry of Environment and Water of 1999. There are three national parks and eleven nature parks in Bulgaria. The three..     english@bnr.bg +359 2 9336 661 ","none","bulgarian",0,0,0,0
"184",528,"https://www.euractiv.com/section/politics/short_news/bulgarians-not-aware-of-the-european-green-deal/","Bulgarians not aware of the European Green Deal","By Krassen Nikolov | EURACTIV.bg 06-11-2020 shutterstock_760522564 [Shutterstock/Bojan Spasovski] Print Email Facebook Twitter LinkedIn WhatsApp Telegram While 74% of Bulgarians are not aware of the goals of the European Green Deal, 44% believe it is compatible with developing nuclear energy and building new nuclear power plants, according to data from a nationally representative survey of the sociological agency “Trend”. Moreover, more than half of Bulgarians (52%) favour the cheapest source of energy no matter where it comes from, while only 9% consider it important how clean the energy they use is, according to the data published at the conference of the Bulgarian Atomic Forum (Bulatom). Bulgarians have the lowest standard of living among EU citizens. Bulatom announced that it would send an appeal to the parliament’s speaker, the prime minister, the energy minister and the speaker of the national assembly’s energy committee, urging them to push the European Commission to include nuclear projects for financing in the bloc’s flagship fund. In September, Deputy Prime Minister Tomislav Donchev directly said that the implementation of the Belene nuclear project was the only way for Bulgaria to meet the objectives of the Green Deal. Bulgaria intends to build the Belene plant with a Russian nuclear reactor. A month ago, Prime Minister Boyko Borissov announced that another nuclear power unit would be built at the current Kozloduy plant, using American technology. (Krassen Nikolov | EURACTIV.bg) Print Email Facebook Twitter LinkedIn WhatsApp Telegram","BUL","bulgarian",0,0,0,0
